{
  "audit": {
    "batch_size_limit_respected": true,
    "covered_candidate_count": 1,
    "duplicate_candidate_ids": [],
    "duplicate_review_record_ids": [],
    "ineligible_batch_members": [],
    "unplanned_candidate_ids": []
  },
  "batch_count": 1,
  "batch_count_formula": "ceil(eligible_count / 10)",
  "batch_size_limit": 10,
  "batches": [
    {
      "batch_id": "publication-batch-001",
      "branch": "feat/issue-338-batch-001",
      "candidate_count": 1,
      "candidates": [
        {
          "candidate_id": "delta-fund-wayfinder-ventures",
          "canonical_name": "Wayfinder Ventures",
          "decision": "eligible",
          "decision_evidence_ids": [
            "evidence-delta-wayfinder-independent-activity",
            "evidence-delta-wayfinder-independent-portfolio"
          ],
          "record_sha256": "f21a60c55c96c0caebb6520453245f4d8ec503a4e319ef86765317d526f885c1",
          "review_record_id": "review:review-2:delta-fund-wayfinder-ventures",
          "validation_partition": 1
        }
      ],
      "ordinal": 1,
      "worktree": ".worktrees/issue-338-batch-001"
    }
  ],
  "cutoff_date": "2026-08-02",
  "eligible_count": 1,
  "eligible_records_sha256": "84ff99b234d878533b0b195c116c6c9bdc7b239eb9a82dd0d74b412fc09c2d18",
  "issue": 338,
  "review_records_sha256": "6cebb5fa7b369631015014a1474fe5338ecb9264c630b58d07fcdbfa0613ba49",
  "schema_version": "1.0",
  "source_decisions_sha256": "ea640962a9cf564d29f01a31c930fffa7afc71a3013ce0f91c787767d89c2ac0",
  "source_manifest": "research/epic-327/review/freeze-manifest.json",
  "source_manifest_sha256": "7ba4964906bb1429a6d392c2feb6c37d2472c3bcea934ef90079a76f5a3974ea"
}
